{
  "schema_version": "0.1",
  "run_id": "run-credential-drift",
  "agent_id": "repo-maintainer",
  "platform": "windows",
  "events": [
    {
      "schema_version": "0.1",
      "event_id": "evt-credential-001",
      "observed_at": "2026-08-29T14:36:17.084Z",
      "sequence": 1,
      "run_id": "run-credential-drift",
      "agent_id": "repo-maintainer",
      "capability": "FILESYSTEM_READ",
      "target": {
        "kind": "path",
        "path": "C:/work/repo/src/index.js"
      },
      "source": "test_fixture"
    },
    {
      "schema_version": "0.1",
      "event_id": "evt-credential-002",
      "observed_at": "2026-08-29T14:36:18.084Z",
      "sequence": 2,
      "run_id": "run-credential-drift",
      "agent_id": "repo-maintainer",
      "capability": "CREDENTIAL_READ",
      "target": {
        "kind": "credential",
        "provider": "environment",
        "name": "NPM_TOKEN"
      },
      "source": "test_fixture"
    },
    {
      "schema_version": "0.1",
      "event_id": "evt-credential-003",
      "observed_at": "2026-08-29T14:36:19.084Z",
      "sequence": 3,
      "run_id": "run-credential-drift",
      "agent_id": "repo-maintainer",
      "capability": "NETWORK_EGRESS",
      "target": {
        "kind": "network_origin",
        "scheme": "https",
        "host": "registry.npmjs.org",
        "port": 443
      },
      "source": "test_fixture"
    }
  ]
}
