{
  "schema_version": "0.1",
  "run_id": "run-normal",
  "agent_id": "repo-maintainer",
  "platform": "windows",
  "events": [
    {
      "schema_version": "0.1",
      "event_id": "evt-normal-001",
      "observed_at": "2026-08-29T14:32:17.084Z",
      "sequence": 1,
      "run_id": "run-normal",
      "agent_id": "repo-maintainer",
      "capability": "FILESYSTEM_READ",
      "target": {
        "kind": "path",
        "path": "C:/work/repo/src/index.js"
      },
      "source": "test_fixture"
    },
    {
      "schema_version": "0.1",
      "event_id": "evt-normal-002",
      "observed_at": "2026-08-29T14:32:18.084Z",
      "sequence": 2,
      "run_id": "run-normal",
      "agent_id": "repo-maintainer",
      "capability": "PROCESS_EXEC",
      "target": {
        "kind": "process",
        "executable": "npm.cmd",
        "args": [
          "test"
        ],
        "shell": false
      },
      "source": "test_fixture"
    }
  ]
}
